{
  "$schema": "../../schemas/public-black-box-report.schema.json",
  "schemaVersion": "1.0.0",
  "benchmarkVersion": "2.0.0",
  "recordedAt": "2026-09-17T20:38:03.695Z",
  "laboratory": {
    "version": "0.0.0",
    "targetSourceCommit": "0f9aa5ecc224ac8aeb662745ddc0adde61095f09"
  },
  "application": {
    "baseUrl": "https://linux-ai2.taile60a95.ts.net:8443",
    "publicFlow": "/",
    "selectedVisibleVersion": "v0.34.0",
    "observedVisibleVersion": "v0.34.0",
    "visibleVersionMatches": true,
    "createPath": "/api/public/v1/scans",
    "createMethod": "POST",
    "contractVersion": "v1",
    "responsibleUseTermsVersion": "2026-08-20.v1",
    "clientContractExposed": true
  },
  "execution": {
    "interface": "public-http-contract",
    "scope": "passive",
    "authenticated": false,
    "activeTesting": false,
    "groundTruthProfile": "public-passive@3",
    "groundTruthRulesetDigest": "sha256:3bc3f542f456190db2bc8d11cc3b458019ac0ed44340d7a092c97878accfcb24",
    "mappingProfile": "rappor-public-black-box@2",
    "mappingProfileDigest": "sha256:9c4aec6a8bad6d0367a56e5f61365cac725d33841fd63c59ebdb0da5fd312592"
  },
  "summary": {
    "runStatus": "completed",
    "verdict": "blocked",
    "clean": false,
    "counts": {
      "true-positive": 22,
      "false-positive": 0,
      "true-negative": 11,
      "false-negative": 7,
      "inconclusive": 0
    },
    "discrepancyCount": 15
  },
  "dimensions": {
    "detection": {
      "status": "mismatch",
      "counts": {
        "true-positive": 22,
        "false-positive": 0,
        "true-negative": 11,
        "false-negative": 7,
        "inconclusive": 0
      }
    },
    "normalization": {
      "status": "mismatch",
      "evaluated": 22,
      "mismatches": 5
    },
    "grouping": {
      "status": "not-exposed",
      "expected": 22,
      "exposed": 0
    },
    "score": {
      "status": "not-exposed",
      "exposed": 0,
      "total": 4
    },
    "lifecycle": {
      "status": "mismatch",
      "matched": 8,
      "mismatches": 2,
      "inconclusive": 0
    },
    "presentation": {
      "status": "passed",
      "available": 22,
      "complete": 22
    }
  },
  "scans": [
    {
      "state": "vulnerable",
      "targetId": "public-vibe-coding-vulnerable",
      "targetRevision": "sha256:800a5c5a263865593afba9196ee2ecdb050f6b4196e8979287b9e71908427365",
      "url": "https://rappor-lab-vulnerable.vercel.app",
      "observedAt": "2026-09-17T20:38:03.046Z",
      "productStatus": "completed",
      "coverageStatus": "complete",
      "runStatus": "completed",
      "findingCount": 5,
      "signalCount": 4,
      "uniqueSignalCount": 3,
      "score": {
        "exposed": false,
        "value": null,
        "status": "not-exposed"
      },
      "observations": [
        {
          "caseId": "public-nextjs-vulnerable",
          "ruleFamily": "nextjs-technology",
          "channel": "signal",
          "expectedPresence": true,
          "observedPresence": false,
          "classification": "false-negative",
          "expectedSeverity": "info",
          "observedSeverities": [],
          "normalization": "not-observed",
          "expectedGroupingKey": "technology-nextjs",
          "observedGroupingKey": null,
          "grouping": "not-applicable",
          "presentation": {
            "available": false,
            "complete": false,
            "itemCount": 0,
            "sources": []
          }
        },
        {
          "caseId": "public-vercel-vulnerable",
          "ruleFamily": "vercel-host-profile",
          "channel": "signal",
          "expectedPresence": true,
          "observedPresence": true,
          "classification": "true-positive",
          "expectedSeverity": "info",
          "observedSeverities": [
            "info"
          ],
          "normalization": "matched",
          "expectedGroupingKey": "hosting-vercel",
          "observedGroupingKey": null,
          "grouping": "not-exposed",
          "presentation": {
            "available": true,
            "complete": true,
            "itemCount": 2,
            "sources": [
              "document",
              "script"
            ]
          }
        },
        {
          "caseId": "public-lovable-vulnerable",
          "ruleFamily": "lovable-generator",
          "channel": "signal",
          "expectedPresence": true,
          "observedPresence": true,
          "classification": "true-positive",
          "expectedSeverity": "info",
          "observedSeverities": [
            "info"
          ],
          "normalization": "matched",
          "expectedGroupingKey": "technology-lovable",
          "observedGroupingKey": null,
          "grouping": "not-exposed",
          "presentation": {
            "available": true,
            "complete": true,
            "itemCount": 1,
            "sources": [
              "document"
            ]
          }
        },
        {
          "caseId": "public-supabase-client-vulnerable",
          "ruleFamily": "supabase-client",
          "channel": "signal",
          "expectedPresence": true,
          "observedPresence": true,
          "classification": "true-positive",
          "expectedSeverity": "info",
          "observedSeverities": [
            "info"
          ],
          "normalization": "matched",
          "expectedGroupingKey": "technology-supabase",
          "observedGroupingKey": null,
          "grouping": "not-exposed",
          "presentation": {
            "available": true,
            "complete": true,
            "itemCount": 1,
            "sources": [
              "script"
            ]
          }
        },
        {
          "caseId": "public-supabase-public-keys-vulnerable",
          "ruleFamily": "supabase-public-keys",
          "channel": "finding",
          "expectedPresence": false,
          "observedPresence": false,
          "classification": "true-negative",
          "expectedSeverity": null,
          "observedSeverities": [],
          "normalization": "not-applicable",
          "expectedGroupingKey": null,
          "observedGroupingKey": null,
          "grouping": "not-applicable",
          "presentation": {
            "available": false,
            "complete": false,
            "itemCount": 0,
            "sources": []
          }
        },
        {
          "caseId": "public-header-vulnerable",
          "ruleFamily": "missing-content-security-policy",
          "channel": "finding",
          "expectedPresence": true,
          "observedPresence": true,
          "classification": "true-positive",
          "expectedSeverity": "low",
          "observedSeverities": [
            "low"
          ],
          "normalization": "matched",
          "expectedGroupingKey": "security-header",
          "observedGroupingKey": null,
          "grouping": "not-exposed",
          "presentation": {
            "available": true,
            "complete": true,
            "itemCount": 1,
            "sources": [
              "RapporCatalog"
            ]
          }
        },
        {
          "caseId": "public-cookie-vulnerable",
          "ruleFamily": "insecure-cookie-attributes",
          "channel": "finding",
          "expectedPresence": true,
          "observedPresence": true,
          "classification": "true-positive",
          "expectedSeverity": "medium",
          "observedSeverities": [
            "low"
          ],
          "normalization": "mismatch",
          "expectedGroupingKey": "cookie-attributes",
          "observedGroupingKey": null,
          "grouping": "not-exposed",
          "presentation": {
            "available": true,
            "complete": true,
            "itemCount": 1,
            "sources": [
              "RapporCatalog"
            ]
          }
        },
        {
          "caseId": "public-form-vulnerable",
          "ruleFamily": "password-form-uses-get",
          "channel": "finding",
          "expectedPresence": true,
          "observedPresence": true,
          "classification": "true-positive",
          "expectedSeverity": "medium",
          "observedSeverities": [
            "medium"
          ],
          "normalization": "matched",
          "expectedGroupingKey": "form-transport",
          "observedGroupingKey": null,
          "grouping": "not-exposed",
          "presentation": {
            "available": true,
            "complete": true,
            "itemCount": 1,
            "sources": [
              "RapporCatalog"
            ]
          }
        },
        {
          "caseId": "public-mixed-content-vulnerable",
          "ruleFamily": "mixed-content",
          "channel": "finding",
          "expectedPresence": true,
          "observedPresence": true,
          "classification": "true-positive",
          "expectedSeverity": "medium",
          "observedSeverities": [
            "low"
          ],
          "normalization": "mismatch",
          "expectedGroupingKey": "mixed-content",
          "observedGroupingKey": null,
          "grouping": "not-exposed",
          "presentation": {
            "available": true,
            "complete": true,
            "itemCount": 1,
            "sources": [
              "RapporCatalog"
            ]
          }
        },
        {
          "caseId": "public-secret-vulnerable",
          "ruleFamily": "synthetic-elevated-secret",
          "channel": "finding",
          "expectedPresence": true,
          "observedPresence": false,
          "classification": "false-negative",
          "expectedSeverity": "high",
          "observedSeverities": [],
          "normalization": "not-observed",
          "expectedGroupingKey": "synthetic-secret-marker",
          "observedGroupingKey": null,
          "grouping": "not-applicable",
          "presentation": {
            "available": false,
            "complete": false,
            "itemCount": 0,
            "sources": []
          }
        }